{"matches": [{"id": "531122349", "offset": 73.569984375, "timeskew": 4.3153763e-05, "frequencyskew": -0.00036239624}, {"id": "575530796", "offset": 224.2293125, "timeskew": 9.560585e-05, "frequencyskew": -0.0003221631}], "location": {"accuracy": 0.01}, "timestamp": 3039980713, "timezone": "Europe/Moscow", "track": {"layout": "5", "type": "MUSIC", "key": "531122349", "title": "The Vivid Love", "subtitle": "Sharmila Sharma", "images": {"background": "https://is1-ssl.mzstatic.com/image/thumb/Music114/v4/5c/7e/b6/5c7eb6dd-96aa-46ac-7fca-02fce7591aab/d894b1fc-b5b7-4d2d-b736-f54cbe013c49.jpg/400x400cc.jpg", "coverart": "https://is1-ssl.mzstatic.com/image/thumb/Music114/v4/5c/7e/b6/5c7eb6dd-96aa-46ac-7fca-02fce7591aab/d894b1fc-b5b7-4d2d-b736-f54cbe013c49.jpg/400x400cc.jpg", "coverarthq": "https://is1-ssl.mzstatic.com/image/thumb/Music114/v4/5c/7e/b6/5c7eb6dd-96aa-46ac-7fca-02fce7591aab/d894b1fc-b5b7-4d2d-b736-f54cbe013c49.jpg/400x400cc.jpg"}, "share": {"subject": "The Vivid Love - Sharmila Sharma", "text": "The Vivid Love by Sharmila Sharma", "href": "https://www.shazam.com/track/531122349/the-vivid-love", "image": "https://is1-ssl.mzstatic.com/image/thumb/Music114/v4/5c/7e/b6/5c7eb6dd-96aa-46ac-7fca-02fce7591aab/d894b1fc-b5b7-4d2d-b736-f54cbe013c49.jpg/400x400cc.jpg", "twitter": "I used @Shazam to discover The Vivid Love by Sharmila Sharma.", "html": "https://www.shazam.com/snippets/email-share/531122349?lang=en-US&country=GB", "snapchat": "https://www.shazam.com/partner/sc/track/531122349"}, "hub": {"type": "APPLEMUSIC", "image": "https://images.shazam.com/static/icons/hub/android/v5/applemusic_{scalefactor}.png", "providers": [{"caption": "Open in Spotify", "images": {"overflow": "https://images.shazam.com/static/icons/hub/android/v5/spotify-overflow_{scalefactor}.png", "default": "https://images.shazam.com/static/icons/hub/android/v5/spotify_{scalefactor}.png"}, "actions": [{"name": "hub:spotify:searchdeeplink", "type": "uri", "uri": "spotify:search:The%20Vivid%20Love%20Sharmila%20Sharma"}], "type": "SPOTIFY"}, {"caption": "Open in YouTube Music", "images": {"overflow": "https://images.shazam.com/static/icons/hub/android/v5/youtubemusic-overflow_{scalefactor}.png", "default": "https://images.shazam.com/static/icons/hub/android/v5/youtubemusic_{scalefactor}.png"}, "actions": [{"name": "hub:youtubemusic:androiddeeplink", "type": "uri", "uri": "https://music.youtube.com/search?q=The+Vivid+Love+Sharmila+Sharma&feature=shazam"}], "type": "YOUTUBEMUSIC"}, {"caption": "Open in Deezer", "images": {"overflow": "https://images.shazam.com/static/icons/hub/android/v5/deezer-overflow_{scalefactor}.png", "default": "https://images.shazam.com/static/icons/hub/android/v5/deezer_{scalefactor}.png"}, "actions": [{"name": "hub:deezer:searchdeeplink", "type": "uri", "uri": "deezer-query://www.deezer.com/play?query=%7Btrack%3A%27The+Vivid+Love%27%20artist%3A%27Sharmila+Sharma%27%7D"}], "type": "DEEZER"}], "explicit": false, "displayname": "APPLE MUSIC", "options": [{"caption": "OPEN IN", "image": "https://images.shazam.com/static/icons/hub/android/v5/overflow-open-option_{scalefactor}.png", "type": "open", "listcaption": "Open in Apple Music", "overflowimage": "https://images.shazam.com/static/icons/hub/android/v5/applemusic-overflow_{scalefactor}.png", "colouroverflowimage": false, "providername": "applemusic"}]}, "sections": [{"type": "SONG", "metapages": [{"image": "https://is1-ssl.mzstatic.com/image/thumb/Music114/v4/5c/7e/b6/5c7eb6dd-96aa-46ac-7fca-02fce7591aab/d894b1fc-b5b7-4d2d-b736-f54cbe013c49.jpg/400x400cc.jpg", "caption": "The Vivid Love"}], "tabname": "Song", "metadata": []}, {"type": "RELATED", "url": "https://cdn.shazam.com/shazam/v3/en-US/GB/android/-/tracks/track-similarities-id-531122349?startFrom=0&pageSize=20&connected=", "tabname": "Related"}], "url": "https://www.shazam.com/track/531122349/the-vivid-love", "artists": [{"id": "42", "adamid": "1543671663"}], "genres": {"primary": "Holiday"}, "urlparams": {"{tracktitle}": "The+Vivid+Love", "{trackartist}": "Sharmila+Sharma"}, "highlightsurls": {}, "relatedtracksurl": "https://cdn.shazam.com/shazam/v3/en-US/GB/android/-/tracks/track-similarities-id-531122349?startFrom=0&pageSize=20&connected="}, "tagid": "2B3DFF36-7668-45E6-B669-DA13CB113A7F"}